{"classifications":[{"definition":"Continuation cannot proceed safely or faithfully without the item.","id":"BLOCKING"},{"definition":"The item can change intent, a decision, a constraint, negative knowledge, an allowed action, or an action dependency.","id":"MATERIAL"},{"definition":"The item cannot change the current working judgment or permitted next action.","id":"NON_MATERIAL"}],"complete_claim_rule":"A COMPLETE Producer claim is permitted only when every omission within the anchored scope is NON_MATERIAL and every material exclusion is explicitly identified for approval.","material_if_affects":["intent","decision","constraint","negative_knowledge","allowed_action","action_dependency","authorization_requirement","external_state_recheck"],"profile_id":"materiality-v1","profile_version":"0.1.0","review_inclusion":["BLOCKING","MATERIAL"]}
